{"as_of":"2026-07-28","business_legibility":"clear","company_name":"兴业银锡","current_price":31.25,"cycle_id":"2026-07-28-all-a-funnel-003","decisive_question":"在剔除2026H1约4.54亿元处置收益、把银锡价格归一至中周期后，宇邦矿业放量与银漫矿业扩建能否在覆盖单矿现金成本、维持性及增长资本开支、安全生产投入和潜在H股摊薄后，形成可持续所有者现金流？31.25元对应约555亿元市值，正式画像若能补齐可采储量—矿山寿命—产量—成本—资本开支桥，答案将直接改变估值判断。","earnings_legibility":"uncertain","governance_status":"acceptable","information_cutoff":"2026-07-28T20:49:58+08:00","price_as_of":"2026-07-28T15:00:00+08:00","price_source_id":"sina-quote-sz000426-20260728","provenance":{"agent":"/root/triage_000612_v3","generated_at":"2026-07-28T20:49:58+08:00","model":"gpt-5","tools":["repository rg and PowerShell cross-checks","CNINFO public filings and local S1 evidence reuse","Sina public quote API","apply_patch"]},"reason_codes":["triage_candidate","silver_and_tin_mining_business_is_legible","eight_operating_mines_and_large_disclosed_resource_base","2025_profit_and_operating_cash_flow_are_strong","2026q1_liquidity_supports_24m_survival","2025_audit_and_internal_control_opinions_are_unmodified","earnings_require_mid_cycle_silver_and_tin_price_normalization","2026h1_reported_profit_contains_material_disposal_gain","single_mine_cash_costs_and_sustaining_capex_are_not_disclosed_clearly","exact_mine_lives_and_recoverable_reserve_bridge_are_missing","top_five_customer_concentration_is_92_20pct","historical_performance_compensation_execution_requires_monitoring","controlling_shareholder_restructuring_history_requires_monitoring","potential_h_share_issuance_creates_unquantified_dilution","one_hour_profile_can_materially_improve_normalized_owner_earnings_estimate"],"research_value":"high","revisit_triggers":[{"condition":"披露2026年半年度报告","reason":"核验宇邦矿业并表放量、银漫矿业产销量、银锡实现价格、4.54亿元非经常性处置收益、经营现金流和在建工程变化，并拆分Q2正常化盈利。","type":"filing"},{"condition":"更新并重新递交H股上市申请，或披露发行规模、价格及募资用途","reason":"实际发行股数和定价会改变每股资源量、每股所有者收益及控制权稀释判断。","type":"event"},{"condition":"公司或合资格人士报告补齐银漫、宇邦等核心矿山的可采储量、精确剩余寿命、分矿产量、现金成本和维持性资本开支","reason":"这些数据是把资源量和高商品价格利润转化为可复算中周期所有者现金流的关键桥梁。","type":"thesis"},{"condition":"披露重大安全生产事故、核心矿山停复产、扩建投产节奏显著变化，或历史业绩补偿执行出现实质进展或恶化","reason":"安全生产、产能兑现与补偿回收会直接改变产量、现金流和治理折价。","type":"event"},{"condition":"最近完整收盘价降至25.00元或以下，且银锡价格、核心矿山产量、安全生产状态和资产负债表未同步恶化","reason":"相对31.25元回落20%后，约444亿元市值可能为中周期价格和资本开支估计误差提供更大缓冲，值得重新核验。","type":"price"}],"schema_version":1,"sources":[{"accessed_at":"2026-07-28T20:45:00+08:00","local_path":"research/companies/CN/000426/sources/2025-annual-report.txt","source_id":"cninfo-annual-2025-000426","supports":["2025年营业收入55.55亿元、归母净利润17.04亿元、扣非归母净利润17.25亿元、经营现金流24.88亿元","银和锡收入占比分别为39.17%和29.70%，前五大客户销售占比92.20%、第一大客户占47.73%","2025年末保有资源量超过5亿吨，银金属量2.98万吨、锡金属量39.16万吨，在产矿业公司8家","银漫矿业保有矿石量5481.9万吨，铅锌银矿银品位185.04克每吨；铜锡银锌矿锡品位0.73%、银品位185.10克每吨","宇邦矿业保有矿石量28597.9万吨，银平均品位72.96克每吨、铅0.48%、锌0.85%","财务报表审计和内部控制审计均为标准无保留意见；报告未清晰拆分单矿现金成本、维持性资本开支和精确剩余矿山寿命"],"tier":"S1","title":"内蒙古兴业银锡矿业股份有限公司2025年年度报告","url":"https://static.cninfo.com.cn/finalpage/2026-04-22/1225136963.PDF"},{"accessed_at":"2026-07-28T20:45:00+08:00","local_path":"research/companies/CN/000426/sources/2026-q1-report.txt","source_id":"cninfo-q1-2026-000426","supports":["2026Q1营业收入21.30亿元、归母净利润13.38亿元、扣非归母净利润8.91亿元、经营现金流12.17亿元","双源有色处置形成投资收益3.21亿元，表观利润不可直接年化","2026年3月末货币资金38.89亿元、短期借款6.72亿元、一年内到期非流动负债8.45亿元、长期借款22.52亿元、应付债券13.70亿元","期末应收账款0.49亿元，结合现金和经营现金流，24个月生存风险可控"],"tier":"S1","title":"内蒙古兴业银锡矿业股份有限公司2026年第一季度报告","url":"https://static.cninfo.com.cn/finalpage/2026-04-30/1225255187.PDF"},{"accessed_at":"2026-07-28T20:45:00+08:00","local_path":null,"source_id":"cninfo-h1-forecast-2026-000426","supports":["预计2026H1归母净利润21.40亿至23.70亿元、扣非归母净利润16.90亿至19.20亿元","增长主要来自宇邦矿业放量、矿产银产销量增长以及银锡价格上涨","双源有色股权转让预计形成4.54亿元非经常性损益，业绩预告未经审计且不能机械年化"],"tier":"S1","title":"内蒙古兴业银锡矿业股份有限公司2026年半年度业绩预告","url":"https://static.cninfo.com.cn/finalpage/2026-07-15/1225422801.PDF"},{"accessed_at":"2026-07-28T20:45:00+08:00","local_path":null,"source_id":"cninfo-h-share-returned-20260717-000426","supports":["联交所因合资格人士报告有效日期需要更新而发回H股上市申请","公司拟把报告基准日更新至2026年6月30日后重新递交申请","H股发行规模和价格尚未确定，潜在每股摊薄暂时无法量化"],"tier":"S1","title":"内蒙古兴业银锡矿业股份有限公司关于H股发行上市申请被发回的公告","url":"https://static.cninfo.com.cn/finalpage/2026-07-17/1225427835.PDF"},{"accessed_at":"2026-07-28T20:45:00+08:00","local_path":null,"source_id":"sina-quote-sz000426-20260728","supports":["2026年7月28日开盘31.00元、最高32.30元、最低31.00元、完整收盘31.25元，前收33.33元","行情返回时间为2026年7月28日15时35分30秒","按约17.756亿股总股本估算，收盘总市值约554.9亿元"],"tier":"S2","title":"新浪财经兴业银锡实时行情（2026年7月28日完整收盘）","url":"https://hq.sinajs.cn/list=sz000426"}],"survival_status":"pass","symbol":"CN:000426","valuation_signal":"possible"}