{"as_of":"2026-07-27","business_legibility":"clear","company_name":"佛塑科技","current_price":11.97,"cycle_id":"2026-07-27-all-a-funnel-002","decisive_question":"剔除非同一控制企业合并形成的45亿至60亿元一次性营业外收入，并计入购买日资产增值带来的成本结转、折旧与摊销后，金力新能源能否把2026H1预告的4亿至6亿元扣非利润转化为持续经营现金流，且足以覆盖约77亿元有息债务和现有、拟建隔膜及尼龙膜项目的资本开支；只有回答这一问题，才能判断11.97元对应的约294亿元市值是否具备进一步研究赔率。","earnings_legibility":"uncertain","governance_status":"concern","information_cutoff":"2026-07-27T05:48:21+08:00","price_as_of":"2026-07-24T15:00:00+08:00","price_source_id":"tencent-kline-000973-20260724","provenance":{"agent":"/root/triage_000973","generated_at":"2026-07-27T05:48:21+08:00","model":"gpt-5","tools":["apply_patch","CNINFO public announcement API","Eastmoney public announcement HTML API","shell_command","Tencent public historical quote API"]},"reason_codes":["triage_candidate","business_clear_functional_films_and_wet_process_battery_separator","jinli_new_energy_consolidated_since_february_2026","h1_2026_core_profit_forecast_implies_material_q2_improvement","q1_reported_profit_includes_455_97m_non_cash_bargain_purchase_gain","q1_operating_cash_flow_negative_365_97m","q1_receivables_2_76bn_and_inventory_1_03bn_require_post_merger_working_capital_review","current_assets_exceed_current_liabilities_and_survival_screen_passes","interest_bearing_debt_about_7_71bn_and_announced_capacity_expansion_raise_capital_intensity","purchase_price_allocation_and_new_depreciation_make_normalized_earnings_uncertain","governance_concern_due_large_acquisition_integration_and_parallel_capex_programs","valuation_possible_at_294_25bn_market_cap_but_not_clearly_attractive_without_cash_conversion","one_hour_profile_can_resolve_normalized_owner_earnings_and_balance_sheet_question"],"research_value":"high","revisit_triggers":[{"condition":"披露2026年半年度报告","reason":"核验8亿至10.5亿元归母净利润和4亿至6亿元扣非净利润预告，拆分金力新能源收入、销量、毛利率、购买价分摊折旧摊销、经营现金流、应收账款、存货和资本开支。","type":"filing"},{"condition":"连续两个报告期扣非利润、经营现金流和自由现金流同步为正，且应收账款增速不再高于隔膜收入增速","reason":"这将证明并购后的盈利改善不只是行业回暖、会计估值和放宽账期的结果，支持建立可承保的正常化所有者收益。","type":"thesis"},{"condition":"披露金力新能源新增69亿平方米隔膜产能、34.69亿元聚酰胺尼龙薄膜项目的投产进度、预算变化或融资安排","reason":"新项目回报率、债务融资成本和投产节奏会直接改变资本开支压力、周期风险及每股价值。","type":"event"},{"condition":"湿法隔膜售价或产能利用率重新下行，金力新能源销量增长未能转化为毛利和现金回款，或购买价分摊摊销显著压低后续扣非利润","reason":"这会证伪隔膜供需修复和并购协同假设，使当前市值主要依赖一次性利润与主题溢价。","type":"thesis"},{"condition":"最近完整收盘价降至10.20元或以下，且半年度报告未显示现金流、隔膜价格、利用率或资产负债表同步恶化","reason":"相对11.97元回落约15%后将进入历史轻量研究的初步价值区间，值得在最新利润与现金流数据上重新计算研究优先级。","type":"price"}],"schema_version":1,"sources":[{"accessed_at":"2026-07-27T05:45:30+08:00","local_path":null,"source_id":"cninfo-q1-2026-000973","supports":["2026Q1营业收入13.34亿元、归母净利润5.56亿元、扣非归母净利润0.98亿元、经营活动现金流净额-3.66亿元","4.56亿元企业合并收益属于无对应现金流入且不具持续性的非经常性损益","金力新能源自2026年2月起并表，2026年2至3月隔膜销量8.78亿平方米、同比增长39.01%，现有总产能约71亿平方米","期末应收账款27.57亿元、存货10.30亿元、流动资产62.48亿元、流动负债45.10亿元","短期借款20.28亿元、一年内到期非流动负债9.62亿元、长期借款47.25亿元，购买价分摊将增加成本结转及折旧摊销"],"tier":"S1","title":"佛山佛塑科技集团股份有限公司2026年第一季度报告","url":"https://static.cninfo.com.cn/finalpage/2026-04-29/1225232100.PDF"},{"accessed_at":"2026-07-27T05:46:30+08:00","local_path":null,"source_id":"cninfo-h1-forecast-2026-000973","supports":["公司预计2026H1归母净利润8.0亿至10.5亿元、扣非归母净利润4.0亿至6.0亿元，预告未经审计","按Q1实际值倒推，Q2归母净利润约2.44亿至4.94亿元、扣非归母净利润约3.02亿至5.02亿元","公司预计企业合并形成45亿至60亿元营业外收入，该收益无对应现金流入且不具持续性","公司明确提示金力新能源整合进度、运营效率、协同释放、市场竞争和原材料价格仍有不确定性"],"tier":"S1","title":"佛山佛塑科技集团股份有限公司2026年半年度业绩预告","url":"https://static.cninfo.com.cn/finalpage/2026-07-15/1225423681.PDF"},{"accessed_at":"2026-07-27T05:47:00+08:00","local_path":"research/companies/CN/000973/reports/2026-07-10-initial.md","source_id":"cninfo-annual-2025-000973","supports":["重组前2025年营业收入22.31亿元、归母净利润1.08亿元、扣非净利润0.98亿元、经营活动现金流净额1.83亿元","历史主业为功能薄膜与复合材料，盈利体量较小但经营现金流高于净利润，不能直接外推并购后的合并主体"],"tier":"S1","title":"佛山佛塑科技集团股份有限公司2025年年度报告","url":"https://static.cninfo.com.cn/finalpage/2026-03-28/1225044595.PDF"},{"accessed_at":"2026-07-27T05:46:16+08:00","local_path":null,"source_id":"tencent-kline-000973-20260724","supports":["2026年7月24日开盘11.90元、最高12.60元、最低11.81元、完整收盘11.97元，成交494981手","最近七个交易日收盘价依次为11.97、11.52、11.10、11.70、11.28、11.99和11.97元","按总股本24.58236766亿股计算，11.97元对应总市值约294.25亿元","7月27日开市前最近完整交易日为7月24日，行情接口时间戳为2026年7月24日16时14分30秒"],"tier":"S2","title":"腾讯证券佛塑科技日K线行情（截至2026年7月24日，前复权参数）","url":"https://web.ifzq.gtimg.cn/appstock/app/fqkline/get?param=sz000973,day,,,10,qfq"}],"survival_status":"pass","symbol":"CN:000973","valuation_signal":"possible"}