{"as_of":"2026-07-28","business_legibility":"clear","company_name":"顺博合金","current_price":6.07,"cycle_id":"2026-07-28-all-a-funnel-003","decisive_question":"在剔除铝价与废铝价错配、存货持有收益和非经常损益后，公司能否把正常化吨扣非利润稳定在250元以上，同时令年度经营现金流覆盖归母净利润、短期借款不再扩张，并证明总投资21.32亿元的63万吨扁锭项目不会因低利用率、新增折旧、17亿元定增和顺博转债潜在转股摊薄而稀释股东回报？6.07元约对应17.5倍粗略TTM归母利润但约27.6倍TTM扣非利润，估值是否便宜取决于价差和现金转换能否持续，而非一季度利润简单年化。","earnings_legibility":"uncertain","governance_status":"acceptable","information_cutoff":"2026-07-29T02:42:11+08:00","price_as_of":"2026-07-28T15:00:00+08:00","price_source_id":"eastmoney-kline-002996-20260728","provenance":{"agent":"/root/triage_000612_v3","generated_at":"2026-07-29T02:42:11+08:00","model":"gpt-5","tools":["repository rg and PowerShell cross-checks","sealed prior rapid-triage and company report evidence reuse","Eastmoney public announcement and quote APIs","in-memory pypdf primary filing extraction","apply_patch"]},"reason_codes":["rapid_triage_price_watch","clear_recycled_aluminum_low_margin_high_turnover_business","q1_revenue_and_adjusted_profit_grew_but_operating_cash_flow_turned_deeply_negative","raw_material_and_finished_aluminum_spread_not_separately_disclosed","q1_inventory_increased_272m_cny_while_accounts_payable_fell_171m_cny","q1_accounts_receivable_declined_but_working_capital_still_consumed_cash","year_end_short_term_borrowings_7_595bn_cny_vs_cash_2_832bn_cny","q1_debt_asset_ratio_76_21pct_and_cash_fell_to_2_388bn_cny","planned_630kt_per_year_slab_project_requires_2_132bn_cny_total_investment","private_placement_authorization_extension_keeps_1_7bn_cny_equity_financing_active","convertible_bond_conversion_price_already_cut_to_10_cny_and_may_be_cut_again","price_6_07_cny_implies_about_4_06bn_cny_market_cap_and_1_17x_q1_book","about_17_5x_parent_ttm_pe_but_27_6x_core_ttm_pe","headline_q1_annualized_pe_understates_normalized_cycle_risk","existing_legacy_research_is_useful_but_requires_current_cycle_horizontal_comparison"],"research_value":"medium","revisit_triggers":[{"condition":"披露2026年半年度报告","reason":"核验销量、吨毛利与吨扣非利润，并拆解原料库存、应收票据及账款、短期借款和经营现金流，判断一季度利润是否来自可持续价差而非库存或周期因素。","type":"filing"},{"condition":"向特定对象发行完成、募投投资预算或建设进度发生重大变化，或顺博转债再次下修转股价并出现集中转股","reason":"17亿元拟募资、63万吨扁锭项目与8.30亿元可转债共同影响摊薄、净债务、折旧和未来产能利用率。","type":"event"},{"condition":"连续两个报告期实现经营现金流为正且累计经营现金流不低于同期归母净利润，同时短期借款不高于2025年末75.95亿元","reason":"这将证明扩张不再主要依赖银行借款和供应链资金，正常化所有者收益开始可读。","type":"thesis"},{"condition":"铝合金锭液正常化吨扣非利润稳定高于250元、压延铝材毛利率稳定高于7%，且新增扁锭产能取得可验证订单与利用率","reason":"只有价差、产品结构和利用率共同改善，低毛利加工业务才值得上调质量与估值中枢。","type":"thesis"},{"condition":"最近完整收盘价降至4.60元或以下，且现金流、短债和扩产条件没有恶化","reason":"相对6.07元回落约24%，并低于旧研究合理区间下沿，可形成初步安全边际；价格下跌不能替代对正常化价差和融资风险的核验。","type":"price"}],"schema_version":1,"sources":[{"accessed_at":"2026-07-27T07:38:00+08:00","local_path":null,"source_id":"issuer-q1-2026-002996","supports":["2026Q1营业收入38.144亿元、归母净利润1.264亿元、扣非归母净利润1.124亿元，分别同比增长9.75%、8.01%和9.94%","2026Q1经营活动现金流净额为-4.800亿元，上年同期为0.681亿元，利润与现金流显著背离","期末总资产145.36亿元、总负债110.78亿元、货币资金23.88亿元、应收账款31.06亿元、存货15.17亿元","一季度借款现金流入38.21亿元、偿还债务41.43亿元，业务高度依赖滚动融资","一季报对上年同期数据进行了会计差错更正，增幅应以调整后口径观察"],"tier":"S1","title":"重庆顺博铝合金股份有限公司2026年第一季度报告","url":"https://pdf.dfcfw.com/pdf/H2_AN202604271821612966_1.pdf"},{"accessed_at":"2026-07-27T07:33:00+08:00","local_path":null,"source_id":"issuer-annual-2025-002996","supports":["2025年铝合金锭液收入149.46亿元、占收入93.50%，该产品毛利率仅1.99%，业务是低毛利高周转加工而非高定价权材料平台","2025年销量91.31万吨、归母净利润2.22亿元、扣非归母净利润1.37亿元，对应吨净利约243元、吨扣非利润约150元","2025年末短期借款75.95亿元、货币资金28.32亿元、应收账款34.08亿元、存货12.46亿元，信用和营运资金是主要约束","2025年经营现金流2.22亿元，但投资现金流为-10.38亿元、筹资现金流为13.22亿元，扩张尚未产生稳定自由现金流"],"tier":"S1","title":"重庆顺博铝合金股份有限公司2025年年度报告全文","url":"https://disc.static.szse.cn/disc/disk03/finalpage/2026-04-27/5b81ba73-2949-4cbb-8b4d-e118b27426cd.PDF"},{"accessed_at":"2026-07-27T07:34:00+08:00","local_path":null,"source_id":"issuer-registration-20260710-002996","supports":["拟募集不超过17.00亿元投向年产63万吨低碳环保型铝合金扁锭项目，项目总投资21.32亿元、建设期3年","扩产带来新增折旧、产能消化、销售价格波动和股权摊薄风险，不能只按一季度利润年化估值"],"tier":"S1","title":"重庆顺博铝合金股份有限公司2026年度向特定对象发行A股股票募集说明书（注册稿）","url":"https://np-cnotice-stock.eastmoney.com/api/content/ann?art_code=AN202607101826878635&client_source=web&page_index=1"},{"accessed_at":"2026-07-29T02:42:11+08:00","local_path":null,"source_id":"issuer-private-placement-extension-20260723-002996","supports":["定增决议和授权原有效期为2025年8月8日至2026年8月7日，公司拟自原期限届满之日起延长12个月","延期旨在持续推进发行，除延长有效期和授权期限外不调整发行方案其他事项","延期尚需提交2026年第三次临时股东会审议"],"tier":"S1","title":"顺博合金关于延长2025年度向特定对象发行A股股票股东会决议有效期及相关授权有效期的公告","url":"https://pdf.dfcfw.com/pdf/H2_AN202607221827255448_1.pdf"},{"accessed_at":"2026-07-29T02:42:11+08:00","local_path":null,"source_id":"issuer-convertible-reset-warning-20260723-002996","supports":["顺博转债发行总额8.30亿元，转股期限至2028年8月11日；2026年7月9日起转股价已由11.16元下修至10元","2026年7月9日至22日已有连续10个交易日收盘价低于当期转股价的85%，预计可能再次触发下修条件","再次下修尚需达到约定条件并履行董事会及股东会等程序，并非已经生效"],"tier":"S1","title":"顺博合金关于顺博转债预计触发转股价格向下修正条件的提示性公告","url":"https://pdf.dfcfw.com/pdf/H2_AN202607221827255452_1.pdf"},{"accessed_at":"2026-07-27T07:36:00+08:00","local_path":null,"source_id":"eastmoney-balance-002996-20260331","supports":["2026年3月末资产负债率76.21%，流动比率约1.21倍，生存状态未见立即失败但缓冲有限","相较2025年末，存货由12.46亿元增至15.17亿元，应付账款由6.87亿元降至5.17亿元，应收账款由34.08亿元降至31.06亿元","库存增加与对供应商付款共同解释部分经营现金流压力，仍需半年报拆解废铝采购价、产品售价和库存持有损益"],"tier":"S2","title":"东方财富顺博合金主要资产负债表数据（2026年一季报）","url":"https://datacenter-web.eastmoney.com/api/data/v1/get?reportName=RPT_DMSK_FN_BALANCE&columns=ALL&filter=(SECURITY_CODE%3D%22002996%22)&pageNumber=1&pageSize=4&sortTypes=-1&sortColumns=REPORT_DATE"},{"accessed_at":"2026-07-29T02:41:40+08:00","local_path":null,"source_id":"eastmoney-kline-002996-20260728","supports":["2026年7月28日开盘6.03元、最高6.13元、最低5.99元、完整收盘6.07元，成交59332手、成交额约3597万元","按总股本约6.69亿股估算，收盘总市值约40.6亿元；按一季报归母权益约34.58亿元估算市净率约1.17倍","以2025年利润减2025Q1再加2026Q1粗略计算，TTM归母净利润约2.31亿元、扣非归母净利润约1.47亿元，对应市盈率约17.5倍和27.6倍"],"tier":"S2","title":"东方财富顺博合金日K线行情（截至2026年7月28日完整收盘，前复权参数）","url":"https://push2his.eastmoney.com/api/qt/stock/kline/get?secid=0.002996&klt=101&fqt=1&lmt=10&end=20260728&fields1=f1,f2,f3,f4,f5,f6&fields2=f51,f52,f53,f54,f55,f56,f57,f58,f59,f60,f61"}],"survival_status":"pass","symbol":"CN:002996","valuation_signal":"possible"}