{"as_of":"2026-07-28","business_legibility":"clear","company_name":"金房能源","current_price":17.68,"cycle_id":"2026-07-28-all-a-funnel-003","decisive_question":"剔除供暖季季度错配后，公司可持续归母利润和自由现金流是否足以达到约1.5亿元并继续增长，同时天津城科收购能否在不恶化回款和资本回报的情况下贡献现金利润？当前约38.8亿元市值对应约28.3倍滚动归母利润、约40.3倍近三年扣非归母利润中位数，答案若不能被外埠项目成熟度、应收回款和天津项目首个完整供暖季数据证实，则现价缺少明显安全边际。","earnings_legibility":"uncertain","governance_status":"acceptable","information_cutoff":"2026-07-28T19:07:57+08:00","price_as_of":"2026-07-28T15:00:00+08:00","price_source_id":"eastmoney-quote-001210-20260728","provenance":{"agent":"/root/triage_001210_v3","generated_at":"2026-07-28T19:07:57+08:00","model":"gpt-5","tools":["apply_patch","shell_command","Invoke-WebRequest","pypdf"]},"reason_codes":["price_watch","business_clear_heat_supply_is_93pct_of_2025_revenue","survival_pass_q1_liquid_assets_far_exceed_interest_bearing_debt","cash_flow_strong_annually_but_heating_season_working_capital_is_highly_seasonal","receivables_and_contract_asset_impairment_are_key_audit_matter","q1_2026_net_receivables_359_75m_and_credit_impairment_14_66m_require_followup","governance_no_immediate_block_unqualified_audit_and_effective_financial_controls","capital_allocation_uncertain_tianjin_bid_61_8pct_above_appraised_net_assets","earnings_uncertain_q1_2026_contributes_most_annual_profit_and_cannot_be_annualized","valuation_unattractive_market_cap_3_881bn_ttm_pe_28_3x_and_pb_2_63x"],"research_value":"medium","revisit_triggers":[{"condition":"披露2026年半年度报告或更晚定期报告","reason":"复核淡季经营现金流、应收账款和信用减值、资本开支，并建立剔除供暖季错配后的正常化盈利与现金转换率。","type":"filing"},{"condition":"天津城科披露首个完整供暖季的供热面积、收费与燃料机制、收入、利润、资本开支和现金回款","reason":"验证1.532亿元成交价相对0.947亿元评估净资产的溢价是否能创造增量股东回报，以及新增项目是否会摊薄外埠盈利质量。","type":"thesis"},{"condition":"出现大额应收逾期或核销、天津项目新增借款或担保、重大资产减值或其他大额资本运作","reason":"这些事件会直接改变当前短期生存安全垫、治理判断和正常化现金收益。","type":"event"},{"condition":"完整收盘价降至15.50元或以下，且应收、燃料成本、外埠毛利率和天津项目未恶化","reason":"更低价格才可能为季节性、回款和收购整合不确定性提供足够缓冲，届时重算研究优先级。","type":"price"}],"schema_version":1,"sources":[{"accessed_at":"2026-07-28T18:55:00+08:00","local_path":null,"source_id":"issuer-annual-2025-001210-v3","supports":["2025年营业收入11.9917亿元、归母净利润1.3441亿元、扣非归母净利润1.3009亿元、经营活动现金流净额3.4128亿元","供热行业收入11.1514亿元、占营业收入92.99%，业务模式可以快速理解","2025年Q1归母净利润1.2998亿元，Q2和Q3分别亏损0.1013亿元和0.3005亿元，利润高度季节化","2025年末应收账款余额5.0688亿元、坏账准备1.5851亿元、账面价值3.4837亿元；应收及合同资产减值损失约0.6050亿元","2025年末货币资金9.1450亿元，短期借款0.0772亿元、长期借款0.4085亿元，短期偿债压力低","北京地区毛利率31.89%、非北京地区毛利率16.02%，外埠复制质量仍待验证"],"tier":"S1","title":"金房能源集团股份有限公司2025年年度报告","url":"https://pdf.dfcfw.com/pdf/H2_AN202603161820582586_1.pdf"},{"accessed_at":"2026-07-28T18:55:30+08:00","local_path":null,"source_id":"issuer-q1-2026-001210-v3","supports":["2026Q1营业收入6.3248亿元、归母净利润1.3270亿元、扣非归母净利润1.3116亿元，同比分别增长0.54%、2.09%和3.76%","2026Q1经营活动现金流净额-1.2969亿元，销售收现2.6765亿元而经营现金流出4.0784亿元，体现供暖季收支错配","2026-03-31货币资金7.0678亿元、交易性金融资产0.5247亿元，短期借款0.0772亿元、一年内到期非流动负债0.0418亿元、长期借款0.4199亿元","2026-03-31应收账款账面价值3.5975亿元，Q1信用减值损失0.1466亿元，回款与信用成本仍需验证"],"tier":"S1","title":"金房能源集团股份有限公司2026年第一季度报告","url":"https://pdf.dfcfw.com/pdf/H2_AN202604241821553642_1.pdf"},{"accessed_at":"2026-07-28T18:56:00+08:00","local_path":null,"source_id":"issuer-audit-2025-001210-v3","supports":["天健会计师事务所对2025年财务报表出具标准无保留意见","供热运营费收入确认、应收账款和合同资产减值被列为关键审计事项","公司披露不存在导致报告期末起12个月内持续经营能力产生重大疑虑的事项或情况"],"tier":"S1","title":"金房能源集团股份有限公司2025年年度审计报告","url":"https://pdf.dfcfw.com/pdf/H2_AN202603161820582569_1.pdf"},{"accessed_at":"2026-07-28T18:56:30+08:00","local_path":null,"source_id":"issuer-internal-control-2025-001210-v3","supports":["天健会计师事务所认为公司于2025年12月31日在所有重大方面保持了有效的财务报告内部控制","快速甄别阶段未发现审计或财务报告内控的立即阻断项"],"tier":"S1","title":"金房能源集团股份有限公司内部控制审计报告","url":"https://pdf.dfcfw.com/pdf/H2_AN202603161820582570_1.pdf"},{"accessed_at":"2026-07-28T19:02:00+08:00","local_path":null,"source_id":"issuer-tianjin-bid-20260622-001210-v3","supports":["天津城科截至2026-04-30评估净资产0.9472亿元、总负债2.5000亿元，2026年1至4月无营业收入且净亏损0.1042亿元","该交易不构成关联交易或重大资产重组，但首个完整供暖季的现金回报尚未披露"],"tier":"S1","title":"金房能源关于参与竞拍天津市城科智能热力有限公司100%股权的公告","url":"https://pdf.dfcfw.com/pdf/H2_AN202606221823742463_1.pdf"},{"accessed_at":"2026-07-28T19:02:30+08:00","local_path":null,"source_id":"issuer-tianjin-result-20260625-001210-v3","supports":["公司以自有资金1.5322亿元竞得天津城科100%股权","成交价较参与竞拍公告披露的0.9472亿元评估净资产高约61.8%，资本配置回报尚待验证"],"tier":"S1","title":"金房能源关于成功竞拍天津市城科智能热力有限公司100%股权的公告","url":"https://pdf.dfcfw.com/pdf/H2_AN202606251823849127_1.pdf"},{"accessed_at":"2026-07-28T18:57:00+08:00","local_path":null,"source_id":"issuer-distribution-20260527-001210-v3","supports":["每10股转增4股后总股本由1.56812676亿股增至2.19537746亿股","以转增后股本和17.68元收盘价计算总市值约38.81亿元，避免除权前后估值口径错配"],"tier":"S1","title":"金房能源集团股份有限公司2025年度权益分派实施公告","url":"https://pdf.dfcfw.com/pdf/H2_AN202605271822916544_1.pdf"},{"accessed_at":"2026-07-28T18:50:45+08:00","local_path":null,"source_id":"eastmoney-quote-001210-20260728","supports":["2026-07-28收盘价17.68元，开盘18.02元、最高18.45元、最低17.61元、前收18.08元","行情接口更新时间为2026-07-28 15:34:45（北京时间），属于收盘后完整行情"],"tier":"S2","title":"东方财富金房能源2026年7月28日收盘行情","url":"https://push2.eastmoney.com/api/qt/stock/get?secid=0.001210&fields=f43,f44,f45,f46,f47,f48,f57,f58,f60,f86"}],"survival_status":"pass","symbol":"CN:001210","valuation_signal":"unattractive"}