{"as_of":"2026-07-28","business_legibility":"clear","company_name":"苏州银行","current_price":8.12,"cycle_id":"2026-07-28-all-a-funnel-003","decisive_question":"在苏州制造业、外贸、地产及小微客户面临完整周期压力时，将关注、逾期和重组贷款按借款人现金流与抵押物回收率重分类后，约381%的拨备能否保持资产质量优势；同时在贷款高速增长把核心一级资本率压至8.97%的情况下，1.40%左右净息差和经常性前拨备利润能否同时支持双位数ROE、资本内生补充与每股0.36元分红？","earnings_legibility":"plausible","governance_status":"acceptable","information_cutoff":"2026-07-28T22:12:25+08:00","price_as_of":"2026-07-28T16:15:00+08:00","price_source_id":"tencent-quote-sz002966-20260728","provenance":{"agent":"/root/triage_002215_v3","generated_at":"2026-07-28T22:12:35+08:00","model":"gpt-5","tools":["apply_patch","eastmoney_announcement_list_api","local_research_cross_check","powershell","tencent_quote_api"]},"reason_codes":["bank_specific_balance_sheet_and_credit_cost_framework_used","business_clear_suzhou_regional_commercial_bank","2025_revenue_up_1_08pct_parent_profit_up_5_53pct","2025_roe_10_66pct_supports_book_value_compounding","q1_2026_revenue_up_10_94pct_parent_profit_up_8_23pct","2025_net_interest_margin_1_33pct_was_low","q1_2026_net_interest_margin_rebounded_7bp_to_1_40pct","deposit_cost_repricing_supported_interest_income_growth","investment_income_2_731bn_is_material_to_2025_earnings","q1_credit_impairment_loss_up_78_59pct_requires_explanation","npl_ratio_0_82pct_is_low_and_stable","q1_watchlist_ratio_0_82pct_is_low_but_needs_migration_reconciliation","provision_coverage_381_16pct_provides_strong_reported_npl_buffer","provision_coverage_has_declined_materially_from_483_50pct","core_tier1_ratio_declined_to_8_97pct","q1_loan_growth_10_49pct_consumes_capital_quickly","corporate_loans_77_57pct_create_industrial_and_policy_project_concentration","personal_loan_npl_rate_1_82pct_is_higher_than_corporate_0_54pct","suzhou_manufacturing_export_and_property_cycles_require_stress_test","local_state_control_supports_stability_but_creates_policy_return_tradeoff","related_transactions_and_major_litigation_require_continuing_review","2025_cash_dividend_0_36_per_share_implies_4_43pct_yield","price_8_12_is_about_0_71x_quote_pb_and_6_63x_quote_pe","valuation_possible_but_capital_and_migration_must_be_verified","high_research_value_due_strong_quality_and_capital_constraint_tension"],"research_value":"high","revisit_triggers":[{"condition":"披露2026年半年度报告并更新净息差、净利息与投资收益、关注及逾期贷款、重组资产、信用减值、行业敞口、拨备和资本指标","reason":"半年报可验证一季度息差改善是否持续，并解释信用减值上升与拨备覆盖率下降。","type":"filing"},{"condition":"连续两个半年度净息差保持1.38%以上，关注及逾期贷款占比不升，拨备覆盖率保持350%以上且核心一级资本率回升至9.2%以上","reason":"利差、资产质量和资本同步稳定后，较高质量城商行的估值折价才有持续收敛基础。","type":"thesis"},{"condition":"苏州制造业、外贸、地产、小微或个人贷款发生重大违约、重组、风险迁徙及批量处置","reason":"区域产业和出口周期相关性可能使当前低不良率出现滞后上行。","type":"event"},{"condition":"新增关联授信、重大诉讼形成实际损失，或地方国资项目显著改变贷款定价与资本占用","reason":"地方国资治理优势需与关联公平、商业定价和普通股回报共同验证。","type":"event"},{"condition":"披露新的核心一级资本补充、无固定期限资本工具成本或调整分红率","reason":"高速扩表下资本补充方式决定普通股ROE、稀释风险和现金回报。","type":"event"},{"condition":"完整收盘价降至7.30元或以下，且息差、贷款迁徙、拨备、资本和分红未恶化","reason":"更低价格可为资本缓冲收窄、拨备消耗及苏州制造业周期提供更充分补偿。","type":"price"}],"schema_version":1,"sources":[{"accessed_at":"2026-07-28T22:11:05+08:00","local_path":null,"source_id":"eastmoney-annual-2025-002966","supports":["2025年营业收入123.56亿元、同比增长1.08%，归母净利润53.48亿元、同比增长5.53%","净息差1.33%、不良贷款率0.82%、拨备覆盖率418.60%","核心一级资本充足率9.53%、资本充足率14.46%","公司贷款占贷款本金77.57%，个人贷款不良率1.82%高于公司贷款0.54%","投资收益27.31亿元、同比增长17.42%，是盈利的重要组成"],"tier":"S1","title":"苏州银行2025年年度报告","url":"https://np-cnotice-stock.eastmoney.com/api/content/ann?art_code=AN202604281821698674&client_source=web&page_index=1"},{"accessed_at":"2026-07-28T22:11:15+08:00","local_path":null,"source_id":"eastmoney-q1-2026-002966","supports":["2026Q1营业收入36.05亿元、同比增长10.94%，归母净利润16.82亿元、同比增长8.23%","净息差年化1.40%、不良贷款率0.82%、关注类贷款占比0.82%","拨备覆盖率381.16%、拨贷比3.14%，均较年末下降","核心一级资本充足率8.97%，贷款本金较年末增长10.49%","信用减值损失同比增长78.59%"],"tier":"S1","title":"苏州银行2026年第一季度报告","url":"https://np-cnotice-stock.eastmoney.com/api/content/ann?art_code=AN202604281821698628&client_source=web&page_index=1"},{"accessed_at":"2026-07-28T22:11:25+08:00","local_path":null,"source_id":"eastmoney-dividend-2025-002966","supports":["2025年度中期及年末现金分红合计每股0.36元","全年现金股利约16.09亿元、约占归母净利润30.1%","按8.12元收盘价计算税前股息率约4.43%"],"tier":"S1","title":"苏州银行2025年度利润分配方案公告","url":"https://np-cnotice-stock.eastmoney.com/api/content/ann?art_code=AN202604281821698726&client_source=web&page_index=1"},{"accessed_at":"2026-07-28T22:11:35+08:00","local_path":null,"source_id":"eastmoney-related-transaction-20260622-002966","supports":["公司继续发生需董事会审议的关联交易事项","地方股东和产业客户网络需持续审查授信定价、公允性及风险集中"],"tier":"S1","title":"苏州银行关于关联交易事项的公告","url":"https://np-cnotice-stock.eastmoney.com/api/content/ann?art_code=AN202606221823740880&client_source=web&page_index=1"},{"accessed_at":"2026-07-28T22:11:45+08:00","local_path":null,"source_id":"eastmoney-litigation-progress-20260624-002966","supports":["重大诉讼仍有进展，需结合贷款分类、拨备和最终回收复核影响","法律程序和抵押物回收可能导致账面风险指标滞后于经济损失"],"tier":"S1","title":"苏州银行关于诉讼事项进展的公告","url":"https://np-cnotice-stock.eastmoney.com/api/content/ann?art_code=AN202606241823816181&client_source=web&page_index=1"},{"accessed_at":"2026-07-28T22:11:55+08:00","local_path":null,"source_id":"eastmoney-announcement-list-20260728-002966","supports":["截至信息截止时点最新公告为金融债券发行获得核准","未发现2026Q1后更新息差、贷款迁徙、拨备或资本指标的正式财务报告"],"tier":"S2","title":"苏州银行公告列表（截至2026年7月28日）","url":"https://np-anotice-stock.eastmoney.com/api/security/ann?sr=-1&page_size=100&page_index=1&ann_type=A&client_source=web&stock_list=002966"},{"accessed_at":"2026-07-28T22:12:05+08:00","local_path":"research/companies/CN/002966/reports/2026-07-10-initial.md","source_id":"local-sealed-research-crosscheck-002966","supports":["交叉核对年报和一季报的盈利、风险、贷款结构、资本与分红指标","标记关注、逾期、重组和制造业地产客户穿透为深研缺口"],"tier":"S2","title":"苏州银行2026年7月10日初始研究中的正式财报摘录","url":null},{"accessed_at":"2026-07-28T22:12:12+08:00","local_path":null,"source_id":"tencent-quote-sz002966-20260728","supports":["2026年7月28日收盘价8.12元、前收8.07元、涨幅0.62%，最高8.12元、最低7.98元","行情返回时间为2026年7月28日16时15分00秒，总股本约44.71亿股、总市值约363.02亿元","行情口径市盈率约6.63倍、市净率约0.71倍"],"tier":"S2","title":"腾讯证券苏州银行行情快照（2026年7月28日完整收盘）","url":"https://qt.gtimg.cn/q=sz002966"}],"survival_status":"pass","symbol":"CN:002966","valuation_signal":"possible"}