{"as_of":"2026-07-28","business_legibility":"uncertain","company_name":"金圆股份","current_price":4.17,"cycle_id":"2026-07-28-all-a-funnel-003","decisive_question":"江西汇盈金属回收率、存货计价和原料采购价差能否被审计师验证并恢复正毛利，同时公司能否证明其通过阿里锂源及革吉锂业间接持有的捌千错盐湖项目拥有清晰、持续有效且可商业化的矿业权和可采储量，并在不追加大额资本开支的情况下把已投入7.07亿元、进度80.40%的项目转为正现金流？4.17元对应约32.43亿元市值和一季末约0.84倍归母净资产，但2026H1预告继续亏损1.5亿至2.5亿元；若审计保留、负毛利、关联资产出售回款延期和锂项目零收益延续，账面净资产仍可能被减值和亏损侵蚀。","earnings_legibility":"unavailable","governance_status":"concern","information_cutoff":"2026-07-29T01:34:00+08:00","price_as_of":"2026-07-28T15:34:36+08:00","price_source_id":"eastmoney-quote-000546-20260728","provenance":{"agent":"/root/triage_000612_v3","generated_at":"2026-07-29T01:34:00+08:00","model":"gpt-5","tools":["apply_patch","eastmoney_quote_api","eastmoney_announcement_api","sina_finance_announcements","local_research_asset_read"]},"reason_codes":["triage_candidate","business_uncertain_due_recovery_rate_and_lithium_rights_opacity","survival_pass_low_financial_debt_and_current_asset_coverage","qualified_audit_opinion_on_jiangxi_huiying_gold_recovery_rate","2025_resource_recycling_gross_margin_negative_1_58pct","q1_2026_revenue_doubled_but_core_loss_widened","h1_2026_core_loss_forecast_150m_to_250m","inventory_1_487bn_is_39pct_of_q1_parent_equity","q1_inventory_impairment_continued","bajiancuo_project_706_7m_invested_80_4pct_progress_zero_cumulative_return","lithium_mining_title_reserve_grade_and_recovery_economics_not_sufficiently_disclosed","only_2000t_lce_equipment_line_contract_is_visible_not_proven_steady_capacity","ali_lithium_source_and_geji_lithium_are_66pct_owned","geji_lithium_and_huihuang_lithium_remain_loss_making","argentina_lithium_rights_abandoned_and_impaired_184_11m","environmental_disposal_business_is_being_optimized_and_low_efficiency_assets_exited","related_cement_asset_sale_interest_payment_extended_to_2028","control_group_pledged_68_75pct_of_its_holdings","historical_controller_share_freeze_and_related_debt_pressure","price_is_0_84x_q1_parent_book_but_book_value_quality_is_unproven"],"research_value":"high","revisit_triggers":[{"condition":"2026年半年度报告披露江西汇盈金、银、铜回收率、原料品位与采购定价、存货构成和跌价准备，并证明资源化业务毛利率转正","reason":"回收率保留事项直接影响收入、成本、存货和净资产可信度，收入增长本身不能证明价值创造。","type":"filing"},{"condition":"披露捌千错盐湖项目的采矿权或合作权属链、许可有效期、经可靠标准核验的储量与品位、设计和实际产能、综合回收率、单位成本及剩余资本开支","reason":"目前只看到项目投资进度和设备合同，缺少把锂资源期权转换为可估值现金流的核心参数。","type":"filing"},{"condition":"捌千错项目正式投产达产、环保验收或矿业许可获批，或出现延期、停产、追加投资和新增减值","reason":"已投入7.07亿元且累计收益为零，任何进度或预算变化都会显著影响残余资产价值。","type":"event"},{"condition":"浙江华阅支付剩余股权转让本金及延期利息，或再次展期、违约、处置互助金圆股权质押","reason":"关联方资产出售回款已多次调整，实际回收决定账面债权和治理折价。","type":"event"},{"condition":"控股股东质押比例、司法冻结或债务纠纷显著上升，出现平仓、司法处置或控制权变化风险","reason":"控股股东及一致行动人已质押所持股份68.75%，外部债务压力可能传导至治理稳定性。","type":"event"}],"schema_version":1,"sources":[{"accessed_at":"2026-07-29T01:27:00+08:00","local_path":null,"source_id":"sina-annual-report-000546-2025","supports":["2025年收入94.29亿元、归母净亏损2.52亿元、扣非净亏损4.11亿元、经营现金净流出390万元","资源化综合利用收入92.05亿元、毛利率负1.58%；锂业务收入7351万元但革吉锂业亏损4663万元、辉煌锂业亏损1.72亿元","捌千错项目预算8.79亿元、累计投入7.07亿元、进度80.40%、累计收益为零；年产2000吨LCE设备合同7800万元尚未履行","公司通过阿里锂源及革吉锂业持有66%权益，但年报未充分披露捌千错可采储量、品位、矿权期限和商业产能","2025年末存货14.58亿元、货币资金2.04亿元、归母净资产38.97亿元；阿根廷卡罗及帕依项目停止开发并减值1.841亿元","低效环保项目持续退出；2025年无形资产、固定资产及其他非流动资产合计发生大额减值"],"tier":"S1","title":"金圆股份2025年年度报告","url":"https://vip.stock.finance.sina.com.cn/corp/view/vCB_AllBulletinDetail.php?stockid=000546&id=12233085"},{"accessed_at":"2026-07-29T01:28:00+08:00","local_path":null,"source_id":"sina-audit-report-000546-2025","supports":["审计师出具保留意见，无法就江西汇盈2025年金回收率较2024年下降约3.24个百分点取得充分适当证据","保留事项可能影响江西汇盈的收入、成本、存货和利润口径，财务报表是否需要调整尚不确定","长期资产减值为关键审计事项"],"tier":"S1","title":"金圆股份2025年度审计报告","url":"https://vip.stock.finance.sina.com.cn/corp/view/vCB_AllBulletinDetail.php?stockid=000546&id=12233104"},{"accessed_at":"2026-07-29T01:29:00+08:00","local_path":null,"source_id":"sina-q1-report-000546-2026","supports":["2026Q1收入36.35亿元，同比增长108.59%，归母净亏损5812万元、扣非净亏损6173万元、经营现金净流出773万元","营业成本36.57亿元超过收入，新增存货跌价准备1162万元","一季末货币资金1.82亿元、存货14.87亿元、短期借款1108万元、流动资产25.82亿元、流动负债16.23亿元","归母净资产38.40亿元、少数股东权益3.84亿元"],"tier":"S1","title":"金圆股份2026年第一季度报告","url":"https://vip.stock.finance.sina.com.cn/corp/view/vCB_AllBulletinDetail.php?stockid=000546&id=12282654"},{"accessed_at":"2026-07-29T01:30:00+08:00","local_path":null,"source_id":"sina-h1-forecast-000546-20260715","supports":["2026H1预计归母净亏损1.5亿至2.5亿元，上年同期亏损4960万元","预计扣非净亏损1.5亿至2.5亿元，上年同期扣非亏损1.43亿元","公司称同比归母变化主要因上年同期9386万元非经常收益、本期非经常损益较小"],"tier":"S1","title":"金圆股份2026年半年度业绩预告","url":"https://vip.stock.finance.sina.com.cn/corp/view/vCB_AllBulletinDetail.php?stockid=000546&id=12446209"},{"accessed_at":"2026-07-29T01:31:00+08:00","local_path":null,"source_id":"sina-related-cement-sale-extension-000546-20260428","supports":["关联方浙江华阅尚欠互助金圆股权转让本金1亿元及截至2026年5月30日利息1.9287亿元","剩余利息支付展期至2028年5月31日，并以互助金圆100%股权质押担保","该水泥资产出售回款已经历多次补充协议调整"],"tier":"S1","title":"金圆股份关于签署股权转让协议之补充协议四的公告","url":"https://vip.stock.finance.sina.com.cn/corp/view/vCB_AllBulletinDetail.php?stockid=000546&id=12233081"},{"accessed_at":"2026-07-29T01:32:00+08:00","local_path":null,"source_id":"sina-controller-pledge-000546-20260716","supports":["金圆控股及一致行动人持股30.35%，质押1.6224亿股，占其所持股份68.75%、公司总股本20.86%","本次质押用途为控股股东自身生产经营，未约定明确到期日","公司称暂不存在延期或平仓风险，但控股股东质押比例已超过50%"],"tier":"S1","title":"金圆股份关于控股股东部分股份办理质押的公告","url":"https://vip.stock.finance.sina.com.cn/corp/view/vCB_AllBulletinDetail.php?stockid=000546&id=12448318"},{"accessed_at":"2026-07-29T01:33:00+08:00","local_path":null,"source_id":"eastmoney-quote-000546-20260728","supports":["2026年7月28日收盘4.17元，前收4.17元，最高4.25元，最低4.11元","总市值约32.43亿元、流通市值约29.05亿元，行情口径市净率0.84倍","公司持续亏损，因此不使用正数市盈率估值"],"tier":"S2","title":"东方财富金圆股份行情快照（2026年7月28日收盘）","url":"https://push2.eastmoney.com/api/qt/stock/get?secid=0.000546&fields=f43,f44,f45,f46,f57,f58,f60,f86,f116,f117,f162,f167,f168,f170"}],"survival_status":"pass","symbol":"CN:000546","valuation_signal":"possible"}