{"as_of":"2026-07-27","business_legibility":"clear","company_name":"百联股份","current_price":7.44,"cycle_id":"2026-07-27-all-a-funnel-002","decisive_question":"百联股份约0.65倍PB能否由自有核心商业物业、奥莱增长和联营投资兑现，同时在把54.26亿元非流动租赁负债及一年内到期义务资本化、扣除联华超市亏损和改造资本开支后，仍产生足够的经常性归母现金收益；还是资产重估只能靠偶发土地收储而核心零售ROE长期过低？","earnings_legibility":"uncertain","governance_status":"concern","information_cutoff":"2026-07-27T08:41:05+08:00","price_as_of":"2026-07-24T15:00:00+08:00","price_source_id":"tencent-kline-600827-20260724","provenance":{"agent":"/root/triage_600332","generated_at":"2026-07-27T08:41:05+08:00","model":"gpt-5","tools":["apply_patch","shell_command","Eastmoney public financial API","Tencent public historical quote API"]},"reason_codes":["conditional_price_watch","retail_formats_are_legible_but_owned_and_leased_property_economics_need_separation","2025_revenue_24_785bn_down_10_44pct","2025_parent_profit_631m_but_adjusted_parent_profit_only_104m","2025_operating_cash_flow_positive_2_993bn_but_down_71pct","2026q1_parent_profit_792m_driven_by_land_resumption_and_property_transfer","2026q1_adjusted_parent_profit_only_121m_and_down_4_72pct","2026h1_profit_forecast_is_mainly_nonrecurring_land_resumption_income","lianhua_supermarket_2025_loss_177m_is_major_operating_drag","outlet_revenue_growth_and_high_gross_margin_are_positive_but_same_store_data_missing","q1_fixed_assets_12_205bn_and_core_shanghai_properties_offer_hidden_value_optionality","q1_right_of_use_assets_4_839bn_and_noncurrent_lease_liabilities_5_426bn_require_capitalization","one_year_noncurrent_liabilities_1_319bn_may_include_current_lease_obligations","q1_cash_6_887bn_exceeds_borrowings_excluding_leases_but_not_debt_including_lease_obligations","q1_long_term_equity_investments_2_149bn_and_other_equity_investments_3_542bn_need_lookthrough","store_renovation_and_new_outlet_capex_can_delay_cash_return","governance_concern_on_related_party_entrusted_management_and_asset_reorganization","valuation_possible_at_7_44_and_about_0_65x_quote_pb_but_near_midrange_asset_value","low_pb_realization_requires_recurring_profit_asset_recycling_or_actual_buyback","research_value_medium_until_h1_discloses_same_store_rent_and_capex_returns"],"research_value":"medium","revisit_triggers":[{"condition":"披露2026年半年度报告并分业态披露同店销售、客流、出租率、租金、店铺关闭及经营现金流","reason":"验证奥莱和购物中心增长是否足以抵消传统百货、超市及大卖场的结构性压力。","type":"filing"},{"condition":"按项目披露自有与租赁物业面积、账面成本、估值、租赁负债、租金承诺和维护性资本开支","reason":"只有将自有物业隐含价值与租赁义务及改造投入配对，低PB才具有可审计含义。","type":"filing"},{"condition":"连续两个报告期扣非归母净利润年化达到4亿元以上，联华超市亏损显著收窄","reason":"经常性盈利回升是资产价值不再长期折价的核心前提。","type":"thesis"},{"condition":"核心物业实施REITs、资产转让、土地收储或重大改造开业，并披露现金回流与资本开支","reason":"资产盘活只有在现金真正回到上市公司并改善ROE时才构成价值兑现。","type":"event"},{"condition":"重大受托管理终止、关联交易或资产重组方案披露并明确交易定价","reason":"国资体系内资产安排会改变治理折价、资产边界和普通股股东所得。","type":"event"},{"condition":"回购实际实施并注销，同时披露年度资本开支、租赁本金偿还和自由现金流","reason":"注销式回购和剩余自由现金是比账面土地收益更直接的每股价值兑现证据。","type":"filing"},{"condition":"最近完整收盘价低于6.60元，且扣非利润、出租率及租赁负债未恶化","reason":"对应约0.57倍2026Q1每股净资产，较7.44元具有更明确的资产折价保护。","type":"price"}],"schema_version":1,"sources":[{"accessed_at":"2026-07-27T08:39:00+08:00","local_path":"research/companies/CN/600827/reports/2026-07-17-initial.md","source_id":"issuer-q1-2026-600827","supports":["2026Q1归母净利润7.92亿元、扣非归母净利润1.21亿元，表观利润主要来自土地收储及房产转让","期末总资产546.48亿元、归母权益205.79亿元、固定资产122.05亿元、使用权资产48.39亿元","期末货币资金68.87亿元，短期借款4.75亿元、长期借款16.30亿元、一年内到期非流动负债13.19亿元","期末非流动租赁负债54.26亿元，长期股权投资21.49亿元、其他权益工具投资35.42亿元"],"tier":"S1","title":"上海百联集团股份有限公司2026年第一季度报告","url":"https://static.cninfo.com.cn/finalpage/2026-04-30/1225257988.PDF"},{"accessed_at":"2026-07-27T08:38:00+08:00","local_path":"research/companies/CN/600827/reports/2026-07-17-initial.md","source_id":"issuer-annual-2025-600827","supports":["2025年营业收入247.85亿元、归母净利润6.31亿元、扣非归母净利润1.04亿元","2025年经营活动现金流净额29.93亿元但同比下降71.00%","奥特莱斯收入16.03亿元、同比增长5.67%、毛利率79.49%，是少数增长且高毛利业态","联华超市2025年收入191.17亿元、净亏损1.77亿元，持续拖累集团ROE"],"tier":"S1","title":"上海百联集团股份有限公司2025年年度报告","url":"https://static.cninfo.com.cn/finalpage/2026-04-15/1225104222.PDF"},{"accessed_at":"2026-07-27T08:39:00+08:00","local_path":"research/companies/CN/600827/reports/2026-07-17-initial.md","source_id":"issuer-h1-forecast-2026-600827","supports":["公司预计2026H1归母净利润7.30亿至10.95亿元、扣非归母净利润1.50亿至2.25亿元","净利润增加主要来自共青路地块收储收益，不能代表核心零售同店经营改善","扣非利润上限仍不足以支撑当前净资产获得高ROE估值"],"tier":"S1","title":"上海百联集团股份有限公司2026年半年度业绩预增公告","url":"https://dataclouds.cninfo.com.cn/shgonggao/hsomarket/2026/20260714/b3033dc248ce404a9704063426ad4cd0.PDF"},{"accessed_at":"2026-07-27T08:40:00+08:00","local_path":null,"source_id":"eastmoney-balance-600827-2026q1","supports":["交叉核验Q1非流动租赁负债54.26亿元、使用权资产48.39亿元","交叉核验货币资金68.87亿元、短期借款4.75亿元、长期借款16.30亿元、一年内到期非流动负债13.19亿元","交叉核验长期股权投资21.49亿元和其他权益工具投资35.42亿元"],"tier":"S2","title":"东方财富2026Q1合并资产负债表结构化数据","url":"https://datacenter-web.eastmoney.com/api/data/v1/get?reportName=RPT_F10_FINANCE_GBALANCE&columns=ALL&filter=(SECUCODE%3D%22600827.SH%22)&pageNumber=1&pageSize=5&sortColumns=REPORT_DATE&sortTypes=-1"},{"accessed_at":"2026-07-27T08:40:00+08:00","local_path":null,"source_id":"tencent-kline-600827-20260724","supports":["2026年7月24日开盘7.61元、最高7.66元、最低7.43元、完整收盘7.44元","最近七个交易日收盘价依次为7.83、7.65、7.78、7.67、7.61、7.63和7.44元","行情快照显示A股市值约119.37亿元、总市值约132.74亿元、市净率约0.65倍、滚动口径市盈率约10.79倍"],"tier":"S2","title":"腾讯证券百联股份日K线行情（截至2026年7月24日，前复权参数）","url":"https://web.ifzq.gtimg.cn/appstock/app/fqkline/get?param=sh600827,day,,,10,qfq"}],"survival_status":"pass","symbol":"CN:600827","valuation_signal":"possible"}